Name,Original Price,Discounted Price,Reviews,Seller Country
Vantime for Xiaomi Redmi Note 10 Pro Case Hybrid Shockproof Matte Back Cover,1009,990,22,China
Vantime for Xiaomi POCO X3 Pro / POCO X3 NFC Belt Clip Case Kickstand Slim Phone Cover,1009,1099-8%,44,China
CUSTOMIZED MOBILE COVER FOR ALL MODELS,450,999-55%,7,Pakistan
WATERPROOF MOBILE COVER,199,299-33%,1,Pakistan
Universal Soft Silicon Mobile Case/ Elastic Cover,130,250-48%,92,Pakistan
Universal Ladies Fancy Mobile Phone Cover,392,575-32%,47,Pakistan
Joker Pop Socket Mobile Stand / Holder for Boys & Girls - Universal Pop Socket for Mobile Phone & Tablets & Cover,64,150-57%,12,Pakistan
Cartoon Pop Socket for Mobiles,119,400-70%,6,Pakistan
Vivo_Y20 / Y20s / Y12s ShockProof Anti-Burst Scratch Proof Transparent TPU Mobile Back Case,109,199-45%,39,Pakistan
Customized Universal Mobile Back Cover,560,1000-44%,80,Pakistan
Customize Mobile Cover Print your Picture / Name or any Logo - Any Mobile Model,545,1000-46%,2,Pakistan
Peaky Blinders Mobile Phone Soft Back Cover For Any Model,999,1,Pakistan
IPhone 6/6S Matte Solid Color Soft Silicon Mobile Case,170,60,Pakistan
IPhone Xs Max Matte Solid Color Soft Silicon Mobile Case  Pouch ,189,249-24%,26,Pakistan
IPhone 6 / 6S Matte Solid Color Soft Silicon Mobile Case  Pouch ,189,249-24%,73,Pakistan
IPhone 7Plus  7+  Matte Solid Color Soft Silicon Mobile Case  Pouch ,189,249-24%,89,Pakistan
Samsung Galaxy A02s ShockProof Anti-Burst Scratch Proof Transparent TPU Mobile Back Case,116,299-61%,29,Pakistan
Waterproof Case Underwater PVC Bag Transparent Touch Screen Premium Cell Phone Pouch Mobile Cover For Travel,199,208,Pakistan
IPhone 6Plus / 6S Plus Matte Solid Color Soft Silicon Mobile Case  Pouch ,189,249-24%,52,Pakistan
IPAKY Case Back Cover for Vivo_Y20 / Vivo_V20 / Vivo_S1 Pro / Vivo_Y51 Back Pouch with Antishock Bumpers,350,649-46%,13,Pakistan
Pop Socket for Mobiles / Tablets,179,400-55%,23,Pakistan
Customized Universal Mobile Back Cover,649,1000-35%,44,Pakistan
Samsung Galaxy A12 Camera Protection ShockProof Anti-Burst Scratch Proof Transparent TPU Mobile Back Case,116,299-61%,29,Pakistan
Samsung Galaxy Note 8 Anti Shock Corner Bumper Air Bag Soft Transparent Jelly Cover,134,300-55%,43,Pakistan
Universal Customized Printed Mobile Cover,421,999-58%,12,Pakistan
Wrap Sticker For Mobile Covering Scratch Resistant Cover Wrapping Sheet 6*8 Inch Choose Custom Color from 8 colors,20,5,Pakistan
itel A25 / itel A25 Pro Camera Protection ShockProof Anti-Burst Scratch Proof Transparent TPU Mobile Back Case,111,299-63%,20,Pakistan
Samsung Galaxy M31s Anti shock Case Cover Antishock back mobile cover Shockproof,170,399-57%,11,Pakistan
IPhone X / XS Matte Solid Color Soft Silicon Mobile Case  Pouch ,189,249-24%,20,Pakistan
Heart Pop Socket Mobile Stand / Holder for Boys & Girls - Universal Pop Socket for Mobile Phone & Tablets & Cover - Black & White,64,150-57%,28,Pakistan
101% Pure 1.5 MM Realme_ Narzo 30a Transparent Bumper Cover AVailable[Must Watch Upper video to identify the best Quality]---,149,400-63%,81,Pakistan
101% Pure 2.5MM Redmi NOTE 10 PRO Top Quality Soft Bumpe Cover[ Must Watch Upper Video to understand the best Quality],299,500-40%,54,Pakistan
IPhone 7/8 Matte Solid Color Soft Silicon Mobile Case,170,47,Pakistan
IPhone XR Matte Solid Color Soft Silicon Mobile Case  Pouch ,189,249-24%,40,Pakistan
Infinix Hot 10 Case Shockproof Armor Ring holder Protective Mobile Back Cover,850,1001-15%,11,Pakistan
IPhone 11 Pro Max / 11 Pro / 11  IPhone XMax / XsMax  IPhone X / Xs / Xr  IPhone 8 Plus / 8  IPhone 7 Plus / 7  Iphone 6 Plus / 6 colour button Mobile cover  Bumper case Shockproof IPhone Case,382,550-31%,68,Pakistan
Print your Photo on Mobile Cover,350,500-30%,87,Pakistan
Nokia C1 ShockProof Anti-Burst Scratch Proof Transparent TPU Mobile Back Case,114,299-62%,8,Pakistan
Camera protection case For Realme_5 / 5i / 5s / C3 / 6i Camera protection matte Case Matte Translucent Shockproof Hybrid Armor Back Case cover for Realme_ 5 / Realme_ 5s / Realme_ 5i / Realme_ 6i / C3,242,395-39%,10,Pakistan
Realme_Narzo 30A ShockProof Anti-Burst Scratch Proof Transparent TPU Mobile Back Case,115,299-62%,8,Pakistan
