Name,Daraz Mall?,Original Price,Discounted Price,Rating,Reviews,Seller Country
Car Cover–Toyota Corolla 2008-2013 PVC+Cotton – L Size,Yes,6200,3900,5,5,Pakistan
Dextro Top Cover For Kia Sportage,Yes,5500,4899,4.5,12,Pakistan
Suzuki Mehran Top Cover Silver | Full Car Cover Outdoor Snow Ice Dust Sun UV Shade Cover | Auto Exterior Accessories | Water Proof | Dust Proof,No,1999,949,5,38,Pakistan
Low Price Car Top Cover for Suzuki Cultus - Khyber - Charade - Alto - Parachute Quality - Silver,No,1889,1069,4.5,68,Pakistan
Suzuki Baleno Car Top Cover - Dust And Water Proof - Parachute Quality - Silver,No,1899,1149,4.75,31,Pakistan